{
  "type": "CognitiveRecommendationDescriptor",
  "version": "0.1",
  "timestamp": "2026-05-13T23:06:26.947Z",
  "basis": {
    "scanner": "tools/scanner_core.ts",
    "contract": "contracts/COGNITIVE_RECOMMENDATION.v0.1.md",
    "git_status": "observed"
  },
  "signals": [
    {
      "repo": "myc",
      "total": 65,
      "L1_fqdn": 54,
      "L2_parseable": 62,
      "L3_schema_valid": 17,
      "L4a_hash_claimed": 10,
      "L4b_hash_verified": 0,
      "L5_graph_linked": 0,
      "L6_recipe": 1,
      "L7_receipt_backed": 55,
      "L8_published": 7,
      "public_candidate_rows": 2,
      "phases": {
        "raw-fantasy": 0,
        "hypothesis": 7,
        "proposal": 0,
        "experiment": 0,
        "receipt": 55,
        "formula": 3,
        "crystal": 0,
        "compost": 0
      },
      "dirtyLines": []
    },
    {
      "repo": "liquid",
      "total": 282,
      "L1_fqdn": 126,
      "L2_parseable": 19,
      "L3_schema_valid": 18,
      "L4a_hash_claimed": 170,
      "L4b_hash_verified": 0,
      "L5_graph_linked": 139,
      "L6_recipe": 170,
      "L7_receipt_backed": 3,
      "L8_published": 0,
      "public_candidate_rows": 0,
      "phases": {
        "raw-fantasy": 0,
        "hypothesis": 98,
        "proposal": 0,
        "experiment": 167,
        "receipt": 3,
        "formula": 14,
        "crystal": 0,
        "compost": 0
      },
      "dirtyLines": []
    },
    {
      "repo": "omega",
      "total": 296,
      "L1_fqdn": 1,
      "L2_parseable": 246,
      "L3_schema_valid": 5,
      "L4a_hash_claimed": 75,
      "L4b_hash_verified": 0,
      "L5_graph_linked": 0,
      "L6_recipe": 0,
      "L7_receipt_backed": 17,
      "L8_published": 0,
      "public_candidate_rows": 0,
      "phases": {
        "raw-fantasy": 0,
        "hypothesis": 218,
        "proposal": 0,
        "experiment": 0,
        "receipt": 17,
        "formula": 61,
        "crystal": 0,
        "compost": 0
      },
      "dirtyLines": []
    },
    {
      "repo": "trinity",
      "total": 300,
      "L1_fqdn": 75,
      "L2_parseable": 264,
      "L3_schema_valid": 28,
      "L4a_hash_claimed": 128,
      "L4b_hash_verified": 40,
      "L5_graph_linked": 3,
      "L6_recipe": 0,
      "L7_receipt_backed": 214,
      "L8_published": 0,
      "public_candidate_rows": 0,
      "phases": {
        "raw-fantasy": 3,
        "hypothesis": 52,
        "proposal": 4,
        "experiment": 0,
        "receipt": 212,
        "formula": 29,
        "crystal": 0,
        "compost": 0
      },
      "dirtyLines": []
    }
  ],
  "recommendations": [
    {
      "repo": "omega",
      "vector": "deterministic-execution",
      "phase_from": "hypothesis",
      "phase_to": "receipt",
      "pressure": 0.7364864864864865,
      "action": "Convert the next deterministic execution result into a receipt or compost it explicitly.",
      "rationale": "Omega is formula-heavy and currently has uncommitted test output pressure; outputs should become receipts or leave the active graph.",
      "expected_receipt": "A named verification artifact from cargo/deno tests, or an explicit compost decision for non-canonical output.",
      "commands": [
        "deno task check:omega:rust",
        "deno task check:omega:deno"
      ],
      "rank": 1
    },
    {
      "repo": "liquid",
      "vector": "identity-resolution",
      "phase_from": "experiment",
      "phase_to": "receipt",
      "pressure": 0.6028368794326241,
      "action": "Turn FQDN Semantic DNS into a resolver fixture with hash-verified before/after examples.",
      "rationale": "Liquid has high recipe mass; the next gain is proving semantic alias resolution against immutable physical FQDNs.",
      "expected_receipt": "A deterministic resolver fixture that maps semantic FQDN input to physical h.* output and verifies the hash.",
      "commands": [
        "deno task check:liquid:doctor",
        "deno task check:liquid:audit"
      ],
      "rank": 2
    },
    {
      "repo": "trinity",
      "vector": "metacognition",
      "phase_from": "receipt",
      "phase_to": "formula",
      "pressure": 0.29333333333333333,
      "action": "Audit the newly emitted recommendation receipts for phase-transition coherence.",
      "rationale": "Metacognitive loop now emits receipts; the next step is to verify if these receipts correctly map to observed state shifts.",
      "expected_receipt": "A comparison report between recommendation.receipt.json and cognition.delta.json proving coherence.",
      "commands": [
        "deno task cognition:snapshot",
        "deno task cognition:delta",
        "deno task cognition:recommend",
        "deno task cognition:recommend-receipt"
      ],
      "rank": 3
    }
  ]
}